{
  "id": "source:nhs_cryptomix",
  "title": "CryptoMix Ransomware",
  "publisher": "NHS Digital",
  "url": "https://digital.nhs.uk/cyber-alerts/2017/cc-1336",
  "published_at": "2017-05-30",
  "source_type": "threat_intel_report",
  "retrieved_at": "2026-06-08",
  "access_level": "public",
  "public_citability": "medium",
  "license_posture": "open_government_attribution_required",
  "redistribution_policy": "cite_and_summarize_with_attribution",
  "allowed_uses": [
    "public alert claims",
    "campaign context",
    "relationship claims when explicit"
  ],
  "blocked_uses": [
    "copied_prose",
    "misleading reuse",
    "logo_or_mark_use",
    "third_party_embedded_material_without_review"
  ],
  "notice_required": true,
  "trust_notes": "Legacy public cyber alert for CryptoMix ransomware. The page notes the alert may be outdated; use for family identity only, not current activity."
}
